{
  "protocol": "rpen-mod",
  "api": 1,
  "id": "pixel-miner",
  "name": {
    "zh-CN": "像素矿工",
    "en-US": "Pixel Miner"
  },
  "version": "1.0.0",
  "author": "rpe-next",
  "description": {
    "zh-CN": "用像素钻石镐挖走编辑器控件，收集掉落物与经验，再把真正的控件放回屏幕。九格快捷栏，1–9 选择；关闭工具状态保留布局，恢复快捷键或停用模组会全部复原。图像与音效均由程序生成。",
    "en-US": "Mine editor controls away with a pixel diamond pickaxe, collect the drops and experience, then put the real controls back on screen. Nine-slot hotbar, choose with 1–9; hiding the tool keeps the layout, and restoring the shortcut or disabling the mod puts everything back. All images and sounds are generated in code."
  },
  "entry": "main.mjs",
  "conflicts": [
    "sky-dodge"
  ],
  "settings": {
    "toggle-key": {
      "type": "shortcut",
      "label": {
        "zh-CN": "开启 / 关闭工具状态",
        "en-US": "Enable / disable the tool mode"
      },
      "default": "F9",
      "description": {
        "zh-CN": "收起工具栏和手持物品，保留已挖走或重新放置的控件。",
        "en-US": "Hides the toolbar and held item while keeping whatever was mined or placed."
      }
    },
    "restore-key": {
      "type": "shortcut",
      "label": {
        "zh-CN": "恢复全部控件",
        "en-US": "Restore all controls"
      },
      "default": "CTRL&SHIFT&F9",
      "description": {
        "zh-CN": "恢复控件原位置，清空掉落物、物品栏和经验。停用模组也会执行恢复。",
        "en-US": "Puts controls back, clears drops, inventory and experience. Disabling the mod also restores everything."
      }
    },
    "mine-duration": {
      "type": "number",
      "label": {
        "zh-CN": "挖掘时长（秒）",
        "en-US": "Mining time (s)"
      },
      "default": 0.9,
      "min": 0.25,
      "max": 3,
      "step": 0.05
    },
    "sound-volume": {
      "type": "number",
      "label": {
        "zh-CN": "挖掘与拾取音量",
        "en-US": "Mining and pickup volume"
      },
      "default": 0.35,
      "min": 0,
      "max": 1,
      "step": 0.05
    }
  }
}
